{
  "$schema": "https://lovekgd.design/contracts/normalization/component-synthesis-archetype.v0.1.schema.json",
  "applicability": {
    "viewport_modes": [
      "desktop"
    ]
  },
  "archetype_id": "archetype.event-detail.desktop-no-image",
  "display_name": "Event detail — desktop no image",
  "fixture_refs": [
    "fixture.event-detail.desktop-no-image.missing-media",
    "fixture.event-detail.desktop-no-image.broken-media",
    "fixture.event-detail.desktop-no-image.no-image"
  ],
  "fixtures": [
    {
      "content_profile": {
        "cardinality": "not_applicable",
        "content_length": "standard",
        "locale": "ru-RU",
        "media_condition": "missing",
        "runtime_condition": "missing-media"
      },
      "fixture_id": "fixture.event-detail.desktop-no-image.missing-media",
      "source_consumer_ref_ids": [
        "source.current_root_prelaunch.7e8d05ce7735edff"
      ],
      "state": "missing-media"
    },
    {
      "content_profile": {
        "cardinality": "not_applicable",
        "content_length": "standard",
        "locale": "ru-RU",
        "media_condition": "broken",
        "runtime_condition": "broken-media"
      },
      "fixture_id": "fixture.event-detail.desktop-no-image.broken-media",
      "source_consumer_ref_ids": [
        "source.current_root_prelaunch.7e8d05ce7735edff"
      ],
      "state": "broken-media"
    },
    {
      "content_profile": {
        "cardinality": "not_applicable",
        "content_length": "standard",
        "locale": "ru-RU",
        "media_condition": "missing",
        "runtime_condition": "no-image"
      },
      "fixture_id": "fixture.event-detail.desktop-no-image.no-image",
      "source_consumer_ref_ids": [
        "source.current_root_prelaunch.7e8d05ce7735edff"
      ],
      "state": "no-image"
    }
  ],
  "gap_refs": [],
  "instance_graph": {
    "edges": [
      {
        "from_node_id": "node.event-detail.desktop-no-image.001",
        "order": 0,
        "relation": "contains_instance",
        "to_node_id": "node.event-detail.desktop-no-image.002"
      },
      {
        "from_node_id": "node.event-detail.desktop-no-image.001",
        "order": 1,
        "relation": "contains_instance",
        "to_node_id": "node.event-detail.desktop-no-image.003"
      },
      {
        "from_node_id": "node.event-detail.desktop-no-image.001",
        "order": 2,
        "relation": "contains_instance",
        "to_node_id": "node.event-detail.desktop-no-image.004"
      },
      {
        "from_node_id": "node.event-detail.desktop-no-image.001",
        "order": 3,
        "relation": "contains_instance",
        "to_node_id": "node.event-detail.desktop-no-image.005"
      },
      {
        "from_node_id": "node.event-detail.desktop-no-image.001",
        "order": 4,
        "relation": "contains_instance",
        "to_node_id": "node.event-detail.desktop-no-image.006"
      },
      {
        "from_node_id": "node.event-detail.desktop-no-image.006",
        "order": 0,
        "relation": "contains_instance",
        "to_node_id": "node.event-detail.desktop-no-image.007"
      },
      {
        "from_node_id": "node.event-detail.desktop-no-image.006",
        "order": 1,
        "relation": "contains_instance",
        "to_node_id": "node.event-detail.desktop-no-image.008"
      },
      {
        "from_node_id": "node.event-detail.desktop-no-image.009",
        "order": 0,
        "relation": "contains_instance",
        "to_node_id": "node.event-detail.desktop-no-image.010"
      },
      {
        "from_node_id": "node.event-detail.desktop-no-image.010",
        "order": 0,
        "relation": "contains_instance",
        "to_node_id": "node.event-detail.desktop-no-image.011"
      },
      {
        "from_node_id": "node.event-detail.desktop-no-image.010",
        "order": 1,
        "relation": "contains_instance",
        "to_node_id": "node.event-detail.desktop-no-image.012"
      },
      {
        "from_node_id": "node.event-detail.desktop-no-image.010",
        "order": 2,
        "relation": "contains_instance",
        "to_node_id": "node.event-detail.desktop-no-image.013"
      },
      {
        "from_node_id": "node.event-detail.desktop-no-image.010",
        "order": 3,
        "relation": "contains_instance",
        "to_node_id": "node.event-detail.desktop-no-image.014"
      },
      {
        "from_node_id": "node.event-detail.desktop-no-image.014",
        "order": 0,
        "relation": "contains_instance",
        "to_node_id": "node.event-detail.desktop-no-image.015"
      },
      {
        "from_node_id": "node.event-detail.desktop-no-image.010",
        "order": 4,
        "relation": "contains_instance",
        "to_node_id": "node.event-detail.desktop-no-image.016"
      },
      {
        "from_node_id": "node.event-detail.desktop-no-image.017",
        "order": 0,
        "relation": "contains_instance",
        "to_node_id": "node.event-detail.desktop-no-image.018"
      },
      {
        "from_node_id": "node.event-detail.desktop-no-image.017",
        "order": 1,
        "relation": "contains_instance",
        "to_node_id": "node.event-detail.desktop-no-image.019"
      },
      {
        "from_node_id": "node.event-detail.desktop-no-image.020",
        "order": 0,
        "relation": "selects_one_instance",
        "to_node_id": "node.event-detail.desktop-no-image.021"
      },
      {
        "from_node_id": "node.event-detail.desktop-no-image.021",
        "order": 0,
        "relation": "contains_instance",
        "to_node_id": "node.event-detail.desktop-no-image.022"
      },
      {
        "from_node_id": "node.event-detail.desktop-no-image.021",
        "order": 1,
        "relation": "contains_instance",
        "to_node_id": "node.event-detail.desktop-no-image.023"
      },
      {
        "from_node_id": "node.event-detail.desktop-no-image.023",
        "order": 0,
        "relation": "contains_instance",
        "to_node_id": "node.event-detail.desktop-no-image.024"
      },
      {
        "from_node_id": "node.event-detail.desktop-no-image.021",
        "order": 2,
        "relation": "contains_instance",
        "to_node_id": "node.event-detail.desktop-no-image.025"
      },
      {
        "from_node_id": "node.event-detail.desktop-no-image.020",
        "order": 1,
        "relation": "selects_one_instance",
        "to_node_id": "node.event-detail.desktop-no-image.026"
      },
      {
        "from_node_id": "node.event-detail.desktop-no-image.026",
        "order": 0,
        "relation": "contains_instance",
        "to_node_id": "node.event-detail.desktop-no-image.027"
      },
      {
        "from_node_id": "node.event-detail.desktop-no-image.026",
        "order": 1,
        "relation": "contains_instance",
        "to_node_id": "node.event-detail.desktop-no-image.028"
      },
      {
        "from_node_id": "node.event-detail.desktop-no-image.028",
        "order": 0,
        "relation": "contains_instance",
        "to_node_id": "node.event-detail.desktop-no-image.029"
      },
      {
        "from_node_id": "node.event-detail.desktop-no-image.026",
        "order": 2,
        "relation": "contains_instance",
        "to_node_id": "node.event-detail.desktop-no-image.030"
      },
      {
        "from_node_id": "node.event-detail.desktop-no-image.020",
        "order": 2,
        "relation": "selects_one_instance",
        "to_node_id": "node.event-detail.desktop-no-image.031"
      },
      {
        "from_node_id": "node.event-detail.desktop-no-image.031",
        "order": 0,
        "relation": "contains_instance",
        "to_node_id": "node.event-detail.desktop-no-image.032"
      },
      {
        "from_node_id": "node.event-detail.desktop-no-image.031",
        "order": 1,
        "relation": "contains_instance",
        "to_node_id": "node.event-detail.desktop-no-image.033"
      },
      {
        "from_node_id": "node.event-detail.desktop-no-image.033",
        "order": 0,
        "relation": "contains_instance",
        "to_node_id": "node.event-detail.desktop-no-image.034"
      },
      {
        "from_node_id": "node.event-detail.desktop-no-image.031",
        "order": 2,
        "relation": "contains_instance",
        "to_node_id": "node.event-detail.desktop-no-image.035"
      }
    ],
    "nodes": [
      {
        "detached": false,
        "entity_ref": "event.action-group",
        "fixture_refs": [
          "fixture.event-detail.desktop-no-image.missing-media",
          "fixture.event-detail.desktop-no-image.broken-media",
          "fixture.event-detail.desktop-no-image.no-image"
        ],
        "local_overrides": [],
        "node_id": "node.event-detail.desktop-no-image.001",
        "node_kind": "component_instance",
        "order": 0,
        "viewport_modes": [
          "desktop"
        ]
      },
      {
        "detached": false,
        "entity_ref": "core.calendar-action",
        "fixture_refs": [
          "fixture.event-detail.desktop-no-image.missing-media",
          "fixture.event-detail.desktop-no-image.broken-media",
          "fixture.event-detail.desktop-no-image.no-image"
        ],
        "local_overrides": [],
        "node_id": "node.event-detail.desktop-no-image.002",
        "node_kind": "component_instance",
        "order": 0,
        "viewport_modes": [
          "desktop"
        ]
      },
      {
        "detached": false,
        "entity_ref": "core.favorite-action",
        "fixture_refs": [
          "fixture.event-detail.desktop-no-image.missing-media",
          "fixture.event-detail.desktop-no-image.broken-media",
          "fixture.event-detail.desktop-no-image.no-image"
        ],
        "local_overrides": [],
        "node_id": "node.event-detail.desktop-no-image.003",
        "node_kind": "component_instance",
        "order": 1,
        "viewport_modes": [
          "desktop"
        ]
      },
      {
        "detached": false,
        "entity_ref": "core.share-action",